Book;Chapter;Verse;Content
Proverbs;1;1;"The proverbs of Solomon, son of David, king of Israel:"
Proverbs;1;2;"To know wisdom and instruction,"
Proverbs;1;3;"to receive instruction in wise dealing,"
Proverbs;1;4;"to give prudence to the simple,"
Proverbs;1;5;"Let the wise hear and increase in learning,"
Proverbs;1;6;"to understand a proverb and a saying,"
Proverbs;1;7;"The fear of the Lord is the beginning of knowledge;"
Proverbs;1;8;"Hear, my son, your father's instruction,"
Proverbs;1;9;"for they are a graceful garland for your head"
Proverbs;1;10;"My son, if sinners entice you,"
Proverbs;1;11;"If they say, “Come with us, let us lie in wait for blood;"
Proverbs;1;12;"like Sheol let us swallow them alive,"
Proverbs;1;13;"we shall find all precious goods,"
Proverbs;1;14;"throw in your lot among us;"
Proverbs;1;15;"my son, do not walk in the way with them;"
Proverbs;1;16;"for their feet run to evil,"
Proverbs;1;17;"For in vain is a net spread"
Proverbs;1;18;"but these men lie in wait for their own blood;"
Proverbs;1;19;"Such are the ways of everyone who is greedy for unjust gain;"
Proverbs;1;20;"Wisdom cries aloud in the street,"
Proverbs;1;21;"at the head of the noisy streets she cries out;"
Proverbs;1;22;"“How long, O simple ones, will you love being simple?"
Proverbs;1;23;"If you turn at my reproof,"
Proverbs;1;24;"Because I have called and you refused to listen,"
Proverbs;1;25;"because you have ignored all my counsel"
Proverbs;1;26;"I also will laugh at your calamity;"
Proverbs;1;27;"when terror strikes you like a storm"
Proverbs;1;28;"Then they will call upon me, but I will not answer;"
Proverbs;1;29;"Because they hated knowledge"
Proverbs;1;30;"would have none of my counsel"
Proverbs;1;31;"therefore they shall eat the fruit of their way,"
Proverbs;1;32;"For the simple are killed by their turning away,"
Proverbs;1;33;"but whoever listens to me will dwell secure"
Proverbs;2;2;"My son, if you receive my words"
Proverbs;2;2;"making your ear attentive to wisdom"
Proverbs;2;3;"yes, if you call out for insight"
Proverbs;2;4;"if you seek it like silver"
Proverbs;2;5;"then you will understand the fear of the Lord"
Proverbs;2;6;"For the Lord gives wisdom;"
Proverbs;2;7;"he stores up sound wisdom for the upright;"
Proverbs;2;8;"guarding the paths of justice"
Proverbs;2;9;"Then you will understand righteousness and justice"
Proverbs;2;10;"for wisdom will come into your heart,"
Proverbs;2;11;"discretion will watch over you,"
Proverbs;2;12;"delivering you from the way of evil,"
Proverbs;2;13;"who forsake the paths of uprightness"
Proverbs;2;14;"who rejoice in doing evil"
Proverbs;2;15;"men whose paths are crooked,"
Proverbs;2;16;"So you will be delivered from the forbidden woman,"
Proverbs;2;17;"who forsakes the companion of her youth"
Proverbs;2;18;"for her house sinks down to death,"
Proverbs;2;19;"none who go to her come back,"
Proverbs;2;20;"So you will walk in the way of the good"
Proverbs;2;21;"For the upright will inhabit the land,"
Proverbs;2;22;"but the wicked will be cut off from the land,"
Proverbs;3;3;"My son, do not forget my teaching,"
Proverbs;3;2;"for length of days and years of life"
Proverbs;3;3;"Let not steadfast love and faithfulness forsake you;"
Proverbs;3;4;"So you will find favor and good success"
Proverbs;3;5;"Trust in the Lord with all your heart,"
Proverbs;3;6;"In all your ways acknowledge him,"
Proverbs;3;7;"Be not wise in your own eyes;"
Proverbs;3;8;"It will be healing to your flesh"
Proverbs;3;9;"Honor the Lord with your wealth"
Proverbs;3;10;"then your barns will be filled with plenty,"
Proverbs;3;11;"My son, do not despise the Lord's discipline"
Proverbs;3;12;"for the Lord reproves him whom he loves,"
Proverbs;3;13;"Blessed is the one who finds wisdom,"
Proverbs;3;14;"for the gain from her is better than gain from silver"
Proverbs;3;15;"She is more precious than jewels,"
Proverbs;3;16;"Long life is in her right hand;"
Proverbs;3;17;"Her ways are ways of pleasantness,"
Proverbs;3;18;"She is a tree of life to those who lay hold of her;"
Proverbs;3;19;"The Lord by wisdom founded the earth;"
Proverbs;3;20;"by his knowledge the deeps broke open,"
Proverbs;3;21;"My son, do not lose sight of these—"
Proverbs;3;22;"and they will be life for your soul"
Proverbs;3;23;"Then you will walk on your way securely,"
Proverbs;3;24;"If you lie down, you will not be afraid;"
Proverbs;3;25;"Do not be afraid of sudden terror"
Proverbs;3;26;"for the Lord will be your confidence"
Proverbs;3;27;"Do not withhold good from those to whom it is due,"
Proverbs;3;28;"Do not say to your neighbor, “Go, and come again,"
Proverbs;3;29;"Do not plan evil against your neighbor,"
Proverbs;3;30;"Do not contend with a man for no reason,"
Proverbs;3;31;"Do not envy a man of violence"
Proverbs;3;32;"for the devious person is an abomination to the Lord,"
Proverbs;3;33;"The Lord's curse is on the house of the wicked,"
Proverbs;3;34;"Toward the scorners he is scornful,"
Proverbs;3;35;"The wise will inherit honor,"
Proverbs;4;4;"Hear, O sons, a father's instruction,"
Proverbs;4;2;"for I give you good precepts;"
Proverbs;4;3;"When I was a son with my father,"
Proverbs;4;4;"he taught me and said to me,"
Proverbs;4;5;"Get wisdom; get insight;"
Proverbs;4;6;"Do not forsake her, and she will keep you;"
Proverbs;4;7;"The beginning of wisdom is this: Get wisdom,"
Proverbs;4;8;"Prize her highly, and she will exalt you;"
Proverbs;4;9;"She will place on your head a graceful garland;"
Proverbs;4;10;"Hear, my son, and accept my words,"
Proverbs;4;11;"I have taught you the way of wisdom;"
Proverbs;4;12;"When you walk, your step will not be hampered,"
Proverbs;4;13;"Keep hold of instruction; do not let go;"
Proverbs;4;14;"Do not enter the path of the wicked,"
Proverbs;4;15;"Avoid it; do not go on it;"
Proverbs;4;16;"For they cannot sleep unless they have done wrong;"
Proverbs;4;17;"For they eat the bread of wickedness"
Proverbs;4;18;"But the path of the righteous is like the light of dawn,"
Proverbs;4;19;"The way of the wicked is like deep darkness;"
Proverbs;4;20;"My son, be attentive to my words;"
Proverbs;4;21;"Let them not escape from your sight;"
Proverbs;4;22;"For they are life to those who find them,"
Proverbs;4;23;"Keep your heart with all vigilance,"
Proverbs;4;24;"Put away from you crooked speech,"
Proverbs;4;25;"Let your eyes look directly forward,"
Proverbs;4;26;"Ponder the path of your feet;"
Proverbs;4;27;"Do not swerve to the right or to the left;"
Proverbs;5;5;"My son, be attentive to my wisdom;"
Proverbs;5;2;"that you may keep discretion,"
Proverbs;5;3;"For the lips of a forbidden woman drip honey,"
Proverbs;5;4;"but in the end she is bitter as wormwood,"
Proverbs;5;5;"Her feet go down to death;"
Proverbs;5;6;"she does not ponder the path of life;"
Proverbs;5;7;"And now, O sons, listen to me,"
Proverbs;5;8;"Keep your way far from her,"
Proverbs;5;9;"lest you give your honor to others"
Proverbs;5;10;"lest strangers take their fill of your strength,"
Proverbs;5;11;"and at the end of your life you groan,"
Proverbs;5;12;"and you say, “How I hated discipline,"
Proverbs;5;13;"I did not listen to the voice of my teachers"
Proverbs;5;14;"I am at the brink of utter ruin"
Proverbs;5;15;"Drink water from your own cistern,"
Proverbs;5;16;"Should your springs be scattered abroad,"
Proverbs;5;17;"Let them be for yourself alone,"
Proverbs;5;18;"Let your fountain be blessed,"
Proverbs;5;19;"&nbsp;&nbsp;&nbsp;&nbsp;a lovely deer, a graceful doe."
Proverbs;5;20;"Why should you be intoxicated, my son, with a forbidden woman"
Proverbs;5;21;"For a man's ways are before the eyes of the Lord,"
Proverbs;5;22;"The iniquities of the wicked ensnare him,"
Proverbs;5;23;"He dies for lack of discipline,"
Proverbs;6;6;"My son, if you have put up security for your neighbor,"
Proverbs;6;2;"if you are snared in the words of your mouth,"
Proverbs;6;3;"then do this, my son, and save yourself,"
Proverbs;6;4;"Give your eyes no sleep"
Proverbs;6;5;"save yourself like a gazelle from the hand of the hunter,"
Proverbs;6;6;"Go to the ant, O sluggard;"
Proverbs;6;7;"Without having any chief,"
Proverbs;6;8;"she prepares her bread in summer"
Proverbs;6;9;"How long will you lie there, O sluggard?"
Proverbs;6;10;"A little sleep, a little slumber,"
Proverbs;6;11;"and poverty will come upon you like a robber,"
Proverbs;6;12;"A worthless person, a wicked man,"
Proverbs;6;13;"winks with his eyes, signals with his feet,"
Proverbs;6;14;"with perverted heart devises evil,"
Proverbs;6;15;"therefore calamity will come upon him suddenly;"
Proverbs;6;16;"There are six things that the Lord hates,"
Proverbs;6;17;"haughty eyes, a lying tongue,"
Proverbs;6;18;"a heart that devises wicked plans,"
Proverbs;6;19;"a false witness who breathes out lies,"
Proverbs;6;20;"My son, keep your father's commandment,"
Proverbs;6;21;"Bind them on your heart always;"
Proverbs;6;22;"When you walk, they will lead you;"
Proverbs;6;23;"For the commandment is a lamp and the teaching a light,"
Proverbs;6;24;"to preserve you from the evil woman,"
Proverbs;6;25;"Do not desire her beauty in your heart,"
Proverbs;6;26;"for the price of a prostitute is only a loaf of bread,"
Proverbs;6;27;"Can a man carry fire next to his chest"
Proverbs;6;28;"Or can one walk on hot coals"
Proverbs;6;29;"So is he who goes in to his neighbor's wife;"
Proverbs;6;30;"People do not despise a thief if he steals"
Proverbs;6;31;"but if he is caught, he will pay sevenfold;"
Proverbs;6;32;"He who commits adultery lacks sense;"
Proverbs;6;33;"He will get wounds and dishonor,"
Proverbs;6;34;"For jealousy makes a man furious,"
Proverbs;6;35;"He will accept no compensation;"
Proverbs;7;7;"My son, keep my words"
Proverbs;7;2;"keep my commandments and live;"
Proverbs;7;3;"bind them on your fingers;"
Proverbs;7;4;"Say to wisdom, “You are my sister,”"
Proverbs;7;5;"to keep you from the forbidden woman,"
Proverbs;7;6;"For at the window of my house"
Proverbs;7;7;"and I have seen among the simple,"
Proverbs;7;8;"passing along the street near her corner,"
Proverbs;7;9;"in the twilight, in the evening,"
Proverbs;7;10;"And behold, the woman meets him,"
Proverbs;7;11;"She is loud and wayward;"
Proverbs;7;12;"now in the street, now in the market,"
Proverbs;7;13;"She seizes him and kisses him,"
Proverbs;7;14;"“I had to offer sacrifices,"
Proverbs;7;15;"so now I have come out to meet you,"
Proverbs;7;16;"I have spread my couch with coverings,"
Proverbs;7;17;"I have perfumed my bed with myrrh,"
Proverbs;7;18;"Come, let us take our fill of love till morning;"
Proverbs;7;19;"For my husband is not at home;"
Proverbs;7;20;"he took a bag of money with him;"
Proverbs;7;21;"With much seductive speech she persuades him;"
Proverbs;7;22;"All at once he follows her,"
Proverbs;7;23;"&nbsp;&nbsp;&nbsp;&nbsp;till an arrow pierces its liver;"
Proverbs;7;24;"And now, O sons, listen to me,"
Proverbs;7;25;"Let not your heart turn aside to her ways;"
Proverbs;7;26;"for many a victim has she laid low,"
Proverbs;7;27;"Her house is the way to Sheol,"
Proverbs;8;8;"Does not wisdom call?"
Proverbs;8;2;"On the heights beside the way,"
Proverbs;8;3;"beside the gates in front of the town,"
Proverbs;8;4;"“To you, O men, I call,"
Proverbs;8;5;"O simple ones, learn prudence;"
Proverbs;8;6;"Hear, for I will speak noble things,"
Proverbs;8;7;"for my mouth will utter truth;"
Proverbs;8;8;"All the words of my mouth are righteous;"
Proverbs;8;9;"They are all straight to him who understands,"
Proverbs;8;10;"Take my instruction instead of silver,"
Proverbs;8;11;"for wisdom is better than jewels,"
Proverbs;8;12;"“I, wisdom, dwell with prudence,"
Proverbs;8;13;"The fear of the Lord is hatred of evil."
Proverbs;8;14;"I have counsel and sound wisdom;"
Proverbs;8;15;"By me kings reign,"
Proverbs;8;16;"by me princes rule,"
Proverbs;8;17;"I love those who love me,"
Proverbs;8;18;"Riches and honor are with me,"
Proverbs;8;19;"My fruit is better than gold, even fine gold,"
Proverbs;8;20;"I walk in the way of righteousness,"
Proverbs;8;21;"granting an inheritance to those who love me,"
Proverbs;8;22;"“The Lord"
Proverbs;8;23;"Ages ago I was set up,"
Proverbs;8;24;"When there were no depths I was brought forth,"
Proverbs;8;25;"Before the mountains had been shaped,"
Proverbs;8;26;"before he had made the earth with its fields,"
Proverbs;8;27;"When he established the heavens, I was there;"
Proverbs;8;28;"when he made firm the skies above,"
Proverbs;8;29;"when he assigned to the sea its limit,"
Proverbs;8;30;"&nbsp;&nbsp;&nbsp;&nbsp;then I was beside him, like a master workman,"
Proverbs;8;31;"rejoicing in his inhabited world"
Proverbs;8;32;"“And now, O sons, listen to me:"
Proverbs;8;33;"Hear instruction and be wise,"
Proverbs;8;34;"Blessed is the one who listens to me,"
Proverbs;8;35;"For whoever finds me finds life"
Proverbs;8;36;"but he who fails to find me injures himself;"
Proverbs;9;9;"Wisdom has built her house;"
Proverbs;9;2;"She has slaughtered her beasts; she has mixed her wine;"
Proverbs;9;3;"She has sent out her young women to call"
Proverbs;9;4;"“Whoever is simple, let him turn in here!”"
Proverbs;9;5;"“Come, eat of my bread"
Proverbs;9;6;"Leave your simple ways, and live,"
Proverbs;9;7;"Whoever corrects a scoffer gets himself abuse,"
Proverbs;9;8;"Do not reprove a scoffer, or he will hate you;"
Proverbs;9;9;"Give instruction to a wise man, and he will be still wiser;"
Proverbs;9;10;"The fear of the Lord is the beginning of wisdom,"
Proverbs;9;11;"For by me your days will be multiplied,"
Proverbs;9;12;"If you are wise, you are wise for yourself;"
Proverbs;9;13;"The woman Folly is loud;"
Proverbs;9;14;"She sits at the door of her house;"
Proverbs;9;15;"calling to those who pass by,"
Proverbs;9;16;"“Whoever is simple, let him turn in here!”"
Proverbs;9;17;"“Stolen water is sweet,"
Proverbs;9;18;"But he does not know that the dead are there,"
Proverbs;10;10;"The proverbs of Solomon."
Proverbs;10;2;"Treasures gained by wickedness do not profit,"
Proverbs;10;3;"The Lord does not let the righteous go hungry,"
Proverbs;10;4;"A slack hand causes poverty,"
Proverbs;10;5;"He who gathers in summer is a prudent son,"
Proverbs;10;6;"Blessings are on the head of the righteous,"
Proverbs;10;7;"The memory of the righteous is a blessing,"
Proverbs;10;8;"The wise of heart will receive commandments,"
Proverbs;10;9;"Whoever walks in integrity walks securely,"
Proverbs;10;10;"Whoever winks the eye causes trouble,"
Proverbs;10;11;"The mouth of the righteous is a fountain of life,"
Proverbs;10;12;"Hatred stirs up strife,"
Proverbs;10;13;"On the lips of him who has understanding, wisdom is found,"
Proverbs;10;14;"The wise lay up knowledge,"
Proverbs;10;15;"A rich man's wealth is his strong city;"
Proverbs;10;16;"The wage of the righteous leads to life,"
Proverbs;10;17;"Whoever heeds instruction is on the path to life,"
Proverbs;10;18;"The one who conceals hatred has lying lips,"
Proverbs;10;19;"When words are many, transgression is not lacking,"
Proverbs;10;20;"The tongue of the righteous is choice silver;"
Proverbs;10;21;"The lips of the righteous feed many,"
Proverbs;10;22;"The blessing of the Lord makes rich,"
Proverbs;10;23;"Doing wrong is like a joke to a fool,"
Proverbs;10;24;"What the wicked dreads will come upon him,"
Proverbs;10;25;"When the tempest passes, the wicked is no more,"
Proverbs;10;26;"Like vinegar to the teeth and smoke to the eyes,"
Proverbs;10;27;"The fear of the Lord prolongs life,"
Proverbs;10;28;"The hope of the righteous brings joy,"
Proverbs;10;29;"The way of the Lord is a stronghold to the blameless,"
Proverbs;10;30;"The righteous will never be removed,"
Proverbs;10;31;"The mouth of the righteous brings forth wisdom,"
Proverbs;10;32;"The lips of the righteous know what is acceptable,"
Proverbs;11;11;"A false balance is an abomination to the Lord,"
Proverbs;11;2;"When pride comes, then comes disgrace,"
Proverbs;11;3;"The integrity of the upright guides them,"
Proverbs;11;4;"Riches do not profit in the day of wrath,"
Proverbs;11;5;"The righteousness of the blameless keeps his way straight,"
Proverbs;11;6;"The righteousness of the upright delivers them,"
Proverbs;11;7;"When the wicked dies, his hope will perish,"
Proverbs;11;8;"The righteous is delivered from trouble,"
Proverbs;11;9;"With his mouth the godless man would destroy his neighbor,"
Proverbs;11;10;"When it goes well with the righteous, the city rejoices,"
Proverbs;11;11;"By the blessing of the upright a city is exalted,"
Proverbs;11;12;"Whoever belittles his neighbor lacks sense,"
Proverbs;11;13;"Whoever goes about slandering reveals secrets,"
Proverbs;11;14;"Where there is no guidance, a people falls,"
Proverbs;11;15;"Whoever puts up security for a stranger will surely suffer harm,"
Proverbs;11;16;"A gracious woman gets honor,"
Proverbs;11;17;"A man who is kind benefits himself,"
Proverbs;11;18;"The wicked earns deceptive wages,"
Proverbs;11;19;"Whoever is steadfast in righteousness will live,"
Proverbs;11;20;"Those of crooked heart are an abomination to the Lord,"
Proverbs;11;21;"Be assured, an evil person will not go unpunished,"
Proverbs;11;22;"Like a gold ring in a pig's snout"
Proverbs;11;23;"The desire of the righteous ends only in good,"
Proverbs;11;24;"One gives freely, yet grows all the richer;"
Proverbs;11;25;"Whoever brings blessing will be enriched,"
Proverbs;11;26;"The people curse him who holds back grain,"
Proverbs;11;27;"Whoever diligently seeks good seeks favor,"
Proverbs;11;28;"Whoever trusts in his riches will fall,"
Proverbs;11;29;"Whoever troubles his own household will inherit the wind,"
Proverbs;11;30;"The fruit of the righteous is a tree of life,"
Proverbs;11;31;"If the righteous is repaid on earth,"
Proverbs;12;12;"Whoever loves discipline loves knowledge,"
Proverbs;12;2;"A good man obtains favor from the Lord,"
Proverbs;12;3;"No one is established by wickedness,"
Proverbs;12;4;"An excellent wife is the crown of her husband,"
Proverbs;12;5;"The thoughts of the righteous are just;"
Proverbs;12;6;"The words of the wicked lie in wait for blood,"
Proverbs;12;7;"The wicked are overthrown and are no more,"
Proverbs;12;8;"A man is commended according to his good sense,"
Proverbs;12;9;"Better to be lowly and have a servant"
Proverbs;12;10;"Whoever is righteous has regard for the life of his beast,"
Proverbs;12;11;"Whoever works his land will have plenty of bread,"
Proverbs;12;12;"Whoever is wicked covets the spoil of evildoers,"
Proverbs;12;13;"An evil man is ensnared by the transgression of his lips,"
Proverbs;12;14;"From the fruit of his mouth a man is satisfied with good,"
Proverbs;12;15;"The way of a fool is right in his own eyes,"
Proverbs;12;16;"The vexation of a fool is known at once,"
Proverbs;12;17;"Whoever speaks the truth gives honest evidence,"
Proverbs;12;18;"There is one whose rash words are like sword thrusts,"
Proverbs;12;19;"Truthful lips endure forever,"
Proverbs;12;20;"Deceit is in the heart of those who devise evil,"
Proverbs;12;21;"No ill befalls the righteous,"
Proverbs;12;22;"Lying lips are an abomination to the Lord,"
Proverbs;12;23;"A prudent man conceals knowledge,"
Proverbs;12;24;"The hand of the diligent will rule,"
Proverbs;12;25;"Anxiety in a man's heart weighs him down,"
Proverbs;12;26;"One who is righteous is a guide to his neighbor,"
Proverbs;12;27;"Whoever is slothful will not roast his game,"
Proverbs;12;28;"In the path of righteousness is life,"
Proverbs;13;13;"A wise son hears his father's instruction,"
Proverbs;13;2;"From the fruit of his mouth a man eats what is good,"
Proverbs;13;3;"Whoever guards his mouth preserves his life;"
Proverbs;13;4;"The soul of the sluggard craves and gets nothing,"
Proverbs;13;5;"The righteous hates falsehood,"
Proverbs;13;6;"Righteousness guards him whose way is blameless,"
Proverbs;13;7;"One pretends to be rich, yet has nothing;"
Proverbs;13;8;"The ransom of a man's life is his wealth,"
Proverbs;13;9;"The light of the righteous rejoices,"
Proverbs;13;10;"By insolence comes nothing but strife,"
Proverbs;13;11;"Wealth gained hastily will dwindle,"
Proverbs;13;12;"Hope deferred makes the heart sick,"
Proverbs;13;13;"Whoever despises the word brings destruction on himself,"
Proverbs;13;14;"The teaching of the wise is a fountain of life,"
Proverbs;13;15;"Good sense wins favor,"
Proverbs;13;16;"Every prudent man acts with knowledge,"
Proverbs;13;17;"A wicked messenger falls into trouble,"
Proverbs;13;18;"Poverty and disgrace come to him who ignores instruction,"
Proverbs;13;19;"A desire fulfilled is sweet to the soul,"
Proverbs;13;20;"Whoever walks with the wise becomes wise,"
Proverbs;13;21;"Disaster pursues sinners,"
Proverbs;13;22;"A good man leaves an inheritance to his children's children,"
Proverbs;13;23;"The fallow ground of the poor would yield much food,"
Proverbs;13;24;"Whoever spares the rod hates his son,"
Proverbs;13;25;"The righteous has enough to satisfy his appetite,"
Proverbs;14;14;"The wisest of women builds her house,"
Proverbs;14;2;"Whoever walks in uprightness fears the Lord,"
Proverbs;14;3;"By the mouth of a fool comes a rod for his back,"
Proverbs;14;4;"Where there are no oxen, the manger is clean,"
Proverbs;14;5;"A faithful witness does not lie,"
Proverbs;14;6;"A scoffer seeks wisdom in vain,"
Proverbs;14;7;"Leave the presence of a fool,"
Proverbs;14;8;"The wisdom of the prudent is to discern his way,"
Proverbs;14;9;"Fools mock at the guilt offering,"
Proverbs;14;10;"The heart knows its own bitterness,"
Proverbs;14;11;"The house of the wicked will be destroyed,"
Proverbs;14;12;"There is a way that seems right to a man,"
Proverbs;14;13;"Even in laughter the heart may ache,"
Proverbs;14;14;"The backslider in heart will be filled with the fruit of his ways,"
Proverbs;14;15;"The simple believes everything,"
Proverbs;14;16;"One who is wise is cautious and turns away from evil,"
Proverbs;14;17;"A man of quick temper acts foolishly,"
Proverbs;14;18;"The simple inherit folly,"
Proverbs;14;19;"The evil bow down before the good,"
Proverbs;14;20;"The poor is disliked even by his neighbor,"
Proverbs;14;21;"Whoever despises his neighbor is a sinner,"
Proverbs;14;22;"Do they not go astray who devise evil?"
Proverbs;14;23;"In all toil there is profit,"
Proverbs;14;24;"The crown of the wise is their wealth,"
Proverbs;14;25;"A truthful witness saves lives,"
Proverbs;14;26;"In the fear of the Lord one has strong confidence,"
Proverbs;14;27;"The fear of the Lord is a fountain of life,"
Proverbs;14;28;"In a multitude of people is the glory of a king,"
Proverbs;14;29;"Whoever is slow to anger has great understanding,"
Proverbs;14;30;"A tranquil heart gives life to the flesh,"
Proverbs;14;31;"Whoever oppresses a poor man insults his Maker,"
Proverbs;14;32;"The wicked is overthrown through his evildoing,"
Proverbs;14;33;"Wisdom rests in the heart of a man of understanding,"
Proverbs;14;34;"Righteousness exalts a nation,"
Proverbs;14;35;"A servant who deals wisely has the king's favor,"
Proverbs;15;15;"A soft answer turns away wrath,"
Proverbs;15;2;"The tongue of the wise commends knowledge,"
Proverbs;15;3;"The eyes of the Lord are in every place,"
Proverbs;15;4;"A gentle tongue is a tree of life,"
Proverbs;15;5;"A fool despises his father's instruction,"
Proverbs;15;6;"In the house of the righteous there is much treasure,"
Proverbs;15;7;"The lips of the wise spread knowledge;"
Proverbs;15;8;"The sacrifice of the wicked is an abomination to the Lord,"
Proverbs;15;9;"The way of the wicked is an abomination to the Lord,"
Proverbs;15;10;"There is severe discipline for him who forsakes the way;"
Proverbs;15;11;"Sheol and Abaddon lie open before the Lord;"
Proverbs;15;12;"A scoffer does not like to be reproved;"
Proverbs;15;13;"A glad heart makes a cheerful face,"
Proverbs;15;14;"The heart of him who has understanding seeks knowledge,"
Proverbs;15;15;"All the days of the afflicted are evil,"
Proverbs;15;16;"Better is a little with the fear of the Lord"
Proverbs;15;17;"Better is a dinner of herbs where love is"
Proverbs;15;18;"A hot-tempered man stirs up strife,"
Proverbs;15;19;"The way of a sluggard is like a hedge of thorns,"
Proverbs;15;20;"A wise son makes a glad father,"
Proverbs;15;21;"Folly is a joy to him who lacks sense,"
Proverbs;15;22;"Without counsel plans fail,"
Proverbs;15;23;"To make an apt answer is a joy to a man,"
Proverbs;15;24;"The path of life leads upward for the prudent,"
Proverbs;15;25;"The Lord tears down the house of the proud"
Proverbs;15;26;"The thoughts of the wicked are an abomination to the Lord,"
Proverbs;15;27;"Whoever is greedy for unjust gain troubles his own household,"
Proverbs;15;28;"The heart of the righteous ponders how to answer,"
Proverbs;15;29;"The Lord is far from the wicked,"
Proverbs;15;30;"The light of the eyes rejoices the heart,"
Proverbs;15;31;"The ear that listens to life-giving reproof"
Proverbs;15;32;"Whoever ignores instruction despises himself,"
Proverbs;15;33;"The fear of the Lord is instruction in wisdom,"
Proverbs;16;16;"The plans of the heart belong to man,"
Proverbs;16;2;"All the ways of a man are pure in his own eyes,"
Proverbs;16;3;"Commit your work to the Lord,"
Proverbs;16;4;"The Lord has made everything for its purpose,"
Proverbs;16;5;"Everyone who is arrogant in heart is an abomination to the Lord;"
Proverbs;16;6;"By steadfast love and faithfulness iniquity is atoned for,"
Proverbs;16;7;"When a man's ways please the Lord,"
Proverbs;16;8;"Better is a little with righteousness"
Proverbs;16;9;"The heart of man plans his way,"
Proverbs;16;10;"An oracle is on the lips of a king;"
Proverbs;16;11;"A just balance and scales are the Lord's;"
Proverbs;16;12;"It is an abomination to kings to do evil,"
Proverbs;16;13;"Righteous lips are the delight of a king,"
Proverbs;16;14;"A king's wrath is a messenger of death,"
Proverbs;16;15;"In the light of a king's face there is life,"
Proverbs;16;16;"How much better to get wisdom than gold!"
Proverbs;16;17;"The highway of the upright turns aside from evil;"
Proverbs;16;18;"Pride goes before destruction,"
