Book;Chapter;Verse;Content
Proverbs;31;23;"Her husband is known in the gates"
Proverbs;31;24;"She makes linen garments and sells them;"
Proverbs;31;25;"Strength and dignity are her clothing,"
Proverbs;31;26;"She opens her mouth with wisdom,"
Proverbs;31;27;"She looks well to the ways of her household"
Proverbs;31;28;"Her children rise up and call her blessed;"
Proverbs;31;29;"“Many women have done excellently,"
Proverbs;31;30;"Charm is deceitful, and beauty is vain,"
Proverbs;31;31;"Give her of the fruit of her hands,"